"requestedUrl","finalUrl","fetchTime","gatherMode"
"accessibility","td-headers-attr","null","","Screen readers have features to make navigating tables easier. Ensuring `<td>` cells using the `[headers]` attribute only refer to other cells in the same table may improve the experience for screen reader users. [Learn more about the `headers` attribute](https://dequeuniversity.com/rules/axe/4.4/td-headers-attr)."
"accessibility","th-has-data-cells","null","","Screen readers have features to make navigating tables easier. Ensuring table headers always refer to some set of cells may improve the experience for screen reader users. [Learn more about table headers](https://dequeuniversity.com/rules/axe/4.4/th-has-data-cells)."
"accessibility","valid-lang","null","","Specifying a valid [BCP 47 language](https://www.w3.org/International/questions/qa-choosing-language-tags#question) on elements helps ensure that text is pronounced correctly by a screen reader. [Learn how to use the `lang` attribute](https://dequeuniversity.com/rules/axe/4.4/valid-lang)."
"accessibility","video-caption","null","","When a video provides a caption it is easier for deaf and hearing impaired users to access its information. [Learn more about video captions](https://dequeuniversity.com/rules/axe/4.4/video-caption)."
"accessibility","logical-tab-order","null","","Tabbing through the page follows the visual layout. Users cannot focus elements that are offscreen. [Learn more about logical tab ordering](https://web.dev/logical-tab-order/)."
"accessibility","focusable-controls","null","","Custom interactive controls are keyboard focusable and display a focus indicator. [Learn how to make custom controls focusable](https://web.dev/focusable-controls/)."
"accessibility","interactive-element-affordance","null","","Interactive elements, such as links and buttons, should indicate their state and be distinguishable from non-interactive elements. [Learn how to decorate interactive elements with affordance hints](https://web.dev/interactive-element-affordance/)."
"accessibility","managed-focus","null","","If new content, such as a dialog, is added to the page, the user's focus is directed to it. [Learn how to direct focus to new content](https://web.dev/managed-focus/)."
"accessibility","focus-traps","null","","A user can tab into and out of any control or region without accidentally trapping their focus. [Learn how to avoid focus traps](https://web.dev/focus-traps/)."
"accessibility","custom-controls-labels","null","","Custom interactive controls have associated labels, provided by aria-label or aria-labelledby. [Learn more about custom controls and labels](https://web.dev/custom-controls-labels/)."
"accessibility","custom-controls-roles","null","","Custom interactive controls have appropriate ARIA roles. [Learn how to add roles to custom controls](https://web.dev/custom-control-roles/)."
"accessibility","visual-order-follows-dom","null","","DOM order matches the visual order, improving navigation for assistive technology. [Learn more about DOM and visual ordering](https://web.dev/visual-order-follows-dom/)."
"accessibility","offscreen-content-hidden","null","","Offscreen content is hidden with display: none or aria-hidden=true. [Learn how to properly hide offscreen content](https://web.dev/offscreen-content-hidden/)."
"accessibility","use-landmarks","null","","Landmark elements (<main>, <nav>, etc.) are used to improve the keyboard navigation of the page for assistive technology. [Learn more about landmark elements](https://web.dev/use-landmarks/)."
"best-practices","is-on-https","0","1 insecure request found","All sites should be protected with HTTPS, even ones that don't handle sensitive data. This includes avoiding [mixed content](https://developers.google.com/web/fundamentals/security/prevent-mixed-content/what-is-mixed-content), where some resources are loaded over HTTP despite the initial request being served over HTTPS. HTTPS prevents intruders from tampering with or passively listening in on the communications between your app and your users, and is a prerequisite for HTTP/2 and many new web platform APIs. [Learn more about HTTPS](https://web.dev/is-on-https/)."
"best-practices","geolocation-on-start","0","","Users are mistrustful of or confused by sites that request their location without context. Consider tying the request to a user action instead. [Learn more about the geolocation permission](https://web.dev/geolocation-on-start/)."
"best-practices","notification-on-start","0","","Users are mistrustful of or confused by sites that request to send notifications without context. Consider tying the request to user gestures instead. [Learn more about responsibly getting permission for notifications](https://web.dev/notification-on-start/)."
"best-practices","no-vulnerable-libraries","0","4 vulnerabilities detected","Some third-party scripts may contain known security vulnerabilities that are easily identified and exploited by attackers. [Learn more about vulnerable libraries](https://web.dev/no-vulnerable-libraries/)."
"best-practices","csp-xss","null","","A strong Content Security Policy (CSP) significantly reduces the risk of cross-site scripting (XSS) attacks. [Learn how to use a CSP to prevent XSS](https://web.dev/csp-xss/)"
"best-practices","password-inputs-can-be-pasted-into","0","","Preventing password pasting undermines good security policy. [Learn more about user-friendly password fields](https://web.dev/password-inputs-can-be-pasted-into/)."
"best-practices","image-aspect-ratio","0","","Image display dimensions should match natural aspect ratio. [Learn more about image aspect ratio](https://web.dev/image-aspect-ratio/)."
"best-practices","image-size-responsive","0","","Image natural dimensions should be proportional to the display size and the pixel ratio to maximize image clarity. [Learn how to provide responsive images](https://web.dev/serve-responsive-images/)."
"best-practices","preload-fonts","null","","Preload `optional` fonts so first-time visitors may use them. [Learn more about preloading fonts](https://web.dev/preload-optional-fonts/)"
"best-practices","doctype","1","","Specifying a doctype prevents the browser from switching to quirks-mode. [Learn more about the doctype declaration](https://web.dev/doctype/)."
"best-practices","charset","1","","A character encoding declaration is required. It can be done with a `<meta>` tag in the first 1024 bytes of the HTML or in the Content-Type HTTP response header. [Learn more about declaring the character encoding](https://web.dev/charset/)."
"best-practices","js-libraries","null","","All front-end JavaScript libraries detected on the page. [Learn more about this JavaScript library detection diagnostic audit](https://web.dev/js-libraries/)."
"best-practices","deprecations","0","2 warnings found","Deprecated APIs will eventually be removed from the browser. [Learn more about deprecated APIs](https://web.dev/deprecations/)."
"best-practices","errors-in-console","0","","Errors logged to the console indicate unresolved problems. They can come from network request failures and other browser concerns. [Learn more about this errors in console diagnostic audit](https://web.dev/errors-in-console/)"
"best-practices","valid-source-maps","1","","Source maps translate minified code to the original source code. This helps developers debug in production. In addition, Lighthouse is able to provide further insights. Consider deploying source maps to take advantage of these benefits. [Learn more about source maps](https://developers.google.com/web/tools/chrome-devtools/javascript/source-maps)."
"best-practices","inspector-issues","1","","Issues logged to the `Issues` panel in Chrome Devtools indicate unresolved problems. They can come from network request failures, insufficient security controls, and other browser concerns. Open up the Issues panel in Chrome DevTools for more details on each issue."
"seo","viewport","1","","A `<meta name=""viewport"">` not only optimizes your app for mobile screen sizes, but also prevents [a 300 millisecond delay to user input](https://developers.google.com/web/updates/2013/12/300ms-tap-delay-gone-away). [Learn more about using the viewport meta tag](https://web.dev/viewport/)."
"seo","document-title","1","","The title gives screen reader users an overview of the page, and search engine users rely on it heavily to determine if a page is relevant to their search. [Learn more about document titles](https://dequeuniversity.com/rules/axe/4.4/document-title)."
"seo","meta-description","0","","Meta descriptions may be included in search results to concisely summarize page content. [Learn more about the meta description](https://web.dev/meta-description/)."
"seo","http-status-code","1","","Pages with unsuccessful HTTP status codes may not be indexed properly. [Learn more about HTTP status codes](https://web.dev/http-status-code/)."
"seo","link-text","1","","Descriptive link text helps search engines understand your content. [Learn how to make links more accessible](https://web.dev/link-text/)."
"seo","crawlable-anchors","0","","Search engines may use `href` attributes on links to crawl websites. Ensure that the `href` attribute of anchor elements links to an appropriate destination, so more pages of the site can be discovered. [Learn how to make links crawlable](https://support.google.com/webmasters/answer/9112205)"
"seo","is-crawlable","1","","Search engines are unable to include your pages in search results if they don't have permission to crawl them. [Learn more about crawler directives](https://web.dev/is-crawable/)."
"seo","robots-txt","null","","If your robots.txt file is malformed, crawlers may not be able to understand how you want your website to be crawled or indexed. [Learn more about robots.txt](https://web.dev/robots-txt/)."
"seo","image-alt","0","","Informative elements should aim for short, descriptive alternate text. Decorative elements can be ignored with an empty alt attribute. [Learn more about the `alt` attribute](https://dequeuniversity.com/rules/axe/4.4/image-alt)."
"seo","hreflang","1","","hreflang links tell search engines what version of a page they should list in search results for a given language or region. [Learn more about `hreflang`](https://web.dev/hreflang/)."
"seo","canonical","null","","Canonical links suggest which URL to show in search results. [Learn more about canonical links](https://web.dev/canonical/)."
"seo","font-size","1","100% legible text","Font sizes less than 12px are too small to be legible and require mobile visitors to “pinch to zoom” in order to read. Strive to have >60% of page text ≥12px. [Learn more about legible font sizes](https://web.dev/font-size/)."
"seo","plugins","1","","Search engines can't index plugin content, and many devices restrict plugins or don't support them. [Learn more about avoiding plugins](https://web.dev/plugins/)."
"seo","tap-targets","0","0% appropriately sized tap targets","Interactive elements like buttons and links should be large enough (48x48px), and have enough space around them, to be easy enough to tap without overlapping onto other elements. [Learn more about tap targets](https://web.dev/tap-targets/)."
"seo","structured-data","null","","Run the [Structured Data Testing Tool](https://search.google.com/structured-data/testing-tool/) and the [Structured Data Linter](http://linter.structured-data.org/) to validate structured data. [Learn more about Structured Data](https://web.dev/structured-data/)."
"pwa","installable-manifest","0","1 reason","Service worker is the technology that enables your app to use many Progressive Web App features, such as offline, add to homescreen, and push notifications. With proper service worker and manifest implementations, browsers can proactively prompt users to add your app to their homescreen, which can lead to higher engagement. ' +
  '[Learn more about manifest installability requirements](https://web.dev/installable-manifest/)."
"pwa","service-worker","0","","The service worker is the technology that enables your app to use many Progressive Web App features, such as offline, add to homescreen, and push notifications. [Learn more about Service Workers](https://web.dev/service-worker/)."
"pwa","splash-screen","0","","A themed splash screen ensures a high-quality experience when users launch your app from their homescreens. [Learn more about splash screens](https://web.dev/splash-screen/)."
"pwa","themed-omnibox","0","","The browser address bar can be themed to match your site. [Learn more about theming the address bar](https://web.dev/themed-omnibox/)."
"pwa","content-width","1","","If the width of your app's content doesn't match the width of the viewport, your app might not be optimized for mobile screens. [Learn how to size content for the viewport](https://web.dev/content-width/)."
"pwa","viewport","1","","A `<meta name=""viewport"">` not only optimizes your app for mobile screen sizes, but also prevents [a 300 millisecond delay to user input](https://developers.google.com/web/updates/2013/12/300ms-tap-delay-gone-away). [Learn more about using the viewport meta tag](https://web.dev/viewport/)."
"pwa","maskable-icon","0","","A maskable icon ensures that the image fills the entire shape without being letterboxed when installing the app on a device. [Learn about maskable manifest icons](https://web.dev/maskable-icon-audit/)."
"pwa","pwa-cross-browser","null","","To reach the most number of users, sites should work across every major browser. [Learn about cross-browser compatibility](https://web.dev/pwa-cross-browser/)."
"pwa","pwa-page-transitions","null","","Transitions should feel snappy as you tap around, even on a slow network. This experience is key to a user's perception of performance. [Learn more about page transitions](https://web.dev/pwa-page-transitions/)."
"pwa","pwa-each-page-has-url","null","","Ensure individual pages are deep linkable via URL and that URLs are unique for the purpose of shareability on social media. [Learn more about providing deep links](https://web.dev/pwa-each-page-has-url/)."