"requestedUrl","finalUrl","fetchTime","gatherMode"
"http://localhost:10200/dobetterweb/dbw_tester.html","http://localhost:10200/dobetterweb/dbw_tester.html","2021-09-07T20:11:11.853Z","navigation"

category,score
"performance","0.26"
"accessibility","0.78"
"best-practices","0.25"
"seo","0.67"
"pwa","0.33"

category,audit,score,displayValue,description
"performance","first-contentful-paint","0.01","6.8 s","First Contentful Paint marks the time at which the first text or image is painted. [Learn more about the First Contentful Paint metric](https://web.dev/first-contentful-paint/)."
"performance","interactive","0.41","8.2 s","Time to Interactive is the amount of time it takes for the page to become fully interactive. [Learn more about the Time to Interactive metric](https://web.dev/interactive/)."
"performance","speed-index","0.21","8.1 s","Speed Index shows how quickly the contents of a page are visibly populated. [Learn more about the Speed Index metric](https://web.dev/speed-index/)."
"performance","total-blocking-time","0.2","1,220 ms","Sum of all time periods between FCP and Time to Interactive, when task length exceeded 50ms, expressed in milliseconds. [Learn more about the Total Blocking Time metric](https://web.dev/lighthouse-total-blocking-time/)."
"performance","largest-contentful-paint","0.07","6.8 s","Largest Contentful Paint marks the time at which the largest text or image is painted. [Learn more about the Largest Contentful Paint metric](https://web.dev/lighthouse-largest-contentful-paint/)"
"performance","cumulative-layout-shift","0.8","0.136","Cumulative Layout Shift measures the movement of visible elements within the viewport. [Learn more about the Cumulative Layout Shift metric](https://web.dev/cls/)."
"performance","max-potential-fid","0","1,170 ms","The maximum potential First Input Delay that your users could experience is the duration of the longest task. [Learn more about the Maximum Potential First Input Delay metric](https://web.dev/lighthouse-max-potential-fid/)."
"performance","first-meaningful-paint","0.1","6.8 s","First Meaningful Paint measures when the primary content of a page is visible. [Learn more about the First Meaningful Paint metric](https://web.dev/first-meaningful-paint/)."
"performance","render-blocking-resources","1","Potential savings of 0 ms","Resources are blocking the first paint of your page. Consider delivering critical JS/CSS inline and deferring all non-critical JS/styles. [Learn how to eliminate render-blocking resources](https://web.dev/render-blocking-resources/)."
"performance","uses-responsive-images","0.75","Potential savings of 49 KiB","Serve images that are appropriately-sized to save cellular data and improve load time. [Learn how to size images](https://web.dev/uses-responsive-images/)."
"performance","offscreen-images","1","","Consider lazy-loading offscreen and hidden images after all critical resources have finished loading to lower time to interactive. [Learn how to defer offscreen images](https://web.dev/offscreen-images/)."
"performance","unminified-css","1","","Minifying CSS files can reduce network payload sizes. [Learn how to minify CSS](https://web.dev/unminified-css/)."
"performance","unminified-javascript","0.48","Potential savings of 82 KiB","Minifying JavaScript files can reduce payload sizes and script parse time. [Learn how to minify JavaScript](https://web.dev/unminified-javascript/)."
"performance","unused-css-rules","1","","Reduce unused rules from stylesheets and defer CSS not used for above-the-fold content to decrease bytes consumed by network activity. [Learn how to reduce unused CSS](https://web.dev/unused-css-rules/)."
"performance","unused-javascript","0.58","Potential savings of 64 KiB","Reduce unused JavaScript and defer loading scripts until they are required to decrease bytes consumed by network activity. [Learn how to reduce unused JavaScript](https://web.dev/unused-javascript/)."
"performance","uses-optimized-images","1","","Optimized images load faster and consume less cellular data. [Learn how to efficiently encode images](https://web.dev/uses-optimized-images/)."
"performance","modern-image-formats","0.67","Potential savings of 76 KiB","Image formats like WebP and AVIF often provide better compression than PNG or JPEG, which means faster downloads and less data consumption. [Learn more about modern image formats](https://web.dev/uses-webp-images/)."
"performance","uses-text-compression","0.38","Potential savings of 143 KiB","Text-based resources should be served with compression (gzip, deflate or brotli) to minimize total network bytes. [Learn more about text compression](https://web.dev/uses-text-compression/)."
"performance","uses-rel-preconnect","1","","Consider adding `preconnect` or `dns-prefetch` resource hints to establish early connections to important third-party origins. [Learn how to preconnect to required origins](https://web.dev/uses-rel-preconnect/)."
"performance","server-response-time","1","Root document took 570 ms","Keep the server response time for the main document short because all other requests depend on it. [Learn more about the Time to First Byte metric](https://web.dev/time-to-first-byte/)."
"performance","redirects","1","","Redirects introduce additional delays before the page can be loaded. [Learn how to avoid page redirects](https://web.dev/redirects/)."
"performance","uses-rel-preload","null","","Consider using `<link rel=preload>` to prioritize fetching resources that are currently requested later in page load. [Learn how to preload key requests](https://web.dev/uses-rel-preload/)."
"performance","uses-http2","1","","HTTP/2 offers many benefits over HTTP/1.1, including binary headers and multiplexing. [Learn more about HTTP/2](https://web.dev/uses-http2/)."
"performance","efficient-animated-content","0.2","Potential savings of 666 KiB","Large GIFs are inefficient for delivering animated content. Consider using MPEG4/WebM videos for animations and PNG/WebP for static images instead of GIF to save network bytes. [Learn more about efficient video formats](https://web.dev/efficient-animated-content/)"
"performance","duplicated-javascript","1","","Remove large, duplicate JavaScript modules from bundles to reduce unnecessary bytes consumed by network activity. "
"performance","legacy-javascript","0.88","Potential savings of 21 KiB","Polyfills and transforms enable legacy browsers to use new JavaScript features. However, many aren't necessary for modern browsers. For your bundled JavaScript, adopt a modern script deployment strategy using module/nomodule feature detection to reduce the amount of code shipped to modern browsers, while retaining support for legacy browsers. [Learn how to use modern JavaScript](https://web.dev/publish-modern-javascript/)"
"performance","preload-lcp-image","1","","If the LCP element is dynamically added to the page, you should preload the image in order to improve LCP. [Learn more about preloading LCP elements](https://web.dev/optimize-lcp/#preload-important-resources)."
"performance","total-byte-weight","1","Total size was 1,293 KiB","Large network payloads cost users real money and are highly correlated with long load times. [Learn how to reduce payload sizes](https://web.dev/total-byte-weight/)."
"performance","uses-long-cache-ttl","0.02","18 resources found","A long cache lifetime can speed up repeat visits to your page. [Learn more about efficient cache policies](https://web.dev/uses-long-cache-ttl/)."
"performance","dom-size","1","153 elements","A large DOM will increase memory usage, cause longer [style calculations](https://developers.google.com/web/fundamentals/performance/rendering/reduce-the-scope-and-complexity-of-style-calculations), and produce costly [layout reflows](https://developers.google.com/speed/articles/reflow). [Learn how to avoid an excessive DOM size](https://web.dev/dom-size/)."
"performance","critical-request-chains","null","12 chains found","The Critical Request Chains below show you what resources are loaded with a high priority. Consider reducing the length of chains, reducing the download size of resources, or deferring the download of unnecessary resources to improve page load. [Learn how to avoid chaining critical requests](https://web.dev/critical-request-chains/)."
"performance","user-timings","null","42 user timings","Consider instrumenting your app with the User Timing API to measure your app's real-world performance during key user experiences. [Learn more about User Timing marks](https://web.dev/user-timings/)."
"performance","bootup-time","0.89","1.3 s","Consider reducing the time spent parsing, compiling, and executing JS. You may find delivering smaller JS payloads helps with this. [Learn how to reduce Javascript execution time](https://web.dev/bootup-time/)."
"performance","mainthread-work-breakdown","0.86","2.2 s","Consider reducing the time spent parsing, compiling and executing JS. You may find delivering smaller JS payloads helps with this. [Learn how to minimize main-thread work](https://web.dev/mainthread-work-breakdown/)"
"performance","font-display","1","","Leverage the `font-display` CSS feature to ensure text is user-visible while webfonts are loading. [Learn more about `font-display`](https://web.dev/font-display/)."
"performance","resource-summary","null","23 requests • 1,293 KiB","To set budgets for the quantity and size of page resources, add a budget.json file. [Learn more about performance budgets](https://web.dev/use-lighthouse-for-performance-budgets/)."
"performance","third-party-summary","1","Third-party code blocked the main thread for 0 ms","Third-party code can significantly impact load performance. Limit the number of redundant third-party providers and try to load third-party code after your page has primarily finished loading. [Learn how to minimize third-party impact](https://developers.google.com/web/fundamentals/performance/optimizing-content-efficiency/loading-third-party-javascript/)."
"performance","third-party-facades","null","","Some third-party embeds can be lazy loaded. Consider replacing them with a facade until they are required. [Learn how to defer third-parties with a facade](https://web.dev/third-party-facades/)."
"performance","largest-contentful-paint-element","null","1 element found","This is the largest contentful element painted within the viewport. [Learn more about the Largest Contentful Paint element](https://web.dev/lighthouse-largest-contentful-paint/)"
"performance","lcp-lazy-loaded","null","","Above-the-fold images that are lazily loaded render later in the page lifecycle, which can delay the largest contentful paint. [Learn more about optimal lazy loading](https://web.dev/lcp-lazy-loading/)."
"performance","layout-shift-elements","null","5 elements found","These DOM elements contribute most to the CLS of the page."
"performance","uses-passive-event-listeners","0","","Consider marking your touch and wheel event listeners as `passive` to improve your page's scroll performance. [Learn more about adopting passive event listeners](https://web.dev/uses-passive-event-listeners/)."
"performance","no-document-write","0","","For users on slow connections, external scripts dynamically injected via `document.write()` can delay page load by tens of seconds. [Learn how to avoid document.write()](https://web.dev/no-document-write/)."
"performance","long-tasks","null","2 long tasks found","Lists the longest tasks on the main thread, useful for identifying worst contributors to input delay. [Learn how to avoid long main-thread tasks](https://web.dev/long-tasks-devtools/)"
"performance","non-composited-animations","null","1 animated element found","Animations which are not composited can be janky and increase CLS. [Learn how to avoid non-composited animations](https://web.dev/non-composited-animations)"
"performance","unsized-images","0","","Set an explicit width and height on image elements to reduce layout shifts and improve CLS. [Learn how to set image dimensions](https://web.dev/optimize-cls/#images-without-dimensions)"
"performance","viewport","1","","A `<meta name=""viewport"">` not only optimizes your app for mobile screen sizes, but also prevents [a 300 millisecond delay to user input](https://developers.google.com/web/updates/2013/12/300ms-tap-delay-gone-away). [Learn more about using the viewport meta tag](https://web.dev/viewport/)."
"performance","no-unload-listeners","0","","The `unload` event does not fire reliably and listening for it can prevent browser optimizations like the Back-Forward Cache. Use `pagehide` or `visibilitychange` events instead. [Learn more about unload event listeners](https://web.dev/bfcache/#never-use-the-unload-event)"
"performance","performance-budget","null","","Keep the quantity and size of network requests under the targets set by the provided performance budget. [Learn more about performance budgets](https://developers.google.com/web/tools/lighthouse/audits/budgets)."
"performance","timing-budget","null","","Set a timing budget to help you keep an eye on the performance of your site. Performant sites load fast and respond to user input events quickly. [Learn more about performance budgets](https://developers.google.com/web/tools/lighthouse/audits/budgets)."
"performance","network-requests","null","","Lists the network requests that were made during page load."
"performance","network-rtt","null","10 ms","Network round trip times (RTT) have a large impact on performance. If the RTT to an origin is high, it's an indication that servers closer to the user could improve performance. [Learn more about the Round Trip Time](https://hpbn.co/primer-on-latency-and-bandwidth/)."
"performance","network-server-latency","null","580 ms","Server latencies can impact web performance. If the server latency of an origin is high, it's an indication the server is overloaded or has poor backend performance. [Learn more about server response time](https://hpbn.co/primer-on-web-performance/#analyzing-the-resource-waterfall)."
"performance","main-thread-tasks","null","","Lists the toplevel main thread tasks that executed during page load."
"performance","diagnostics","null","","Collection of useful page vitals."
"performance","metrics","null","","Collects all available metrics."
"performance","screenshot-thumbnails","null","","This is what the load of your site looked like."
"performance","final-screenshot","null","","The last screenshot captured of the pageload."
"performance","script-treemap-data","null","","Used for treemap app"
"accessibility","accesskeys","null","","Access keys let users quickly focus a part of the page. For proper navigation, each access key must be unique. [Learn more about access keys](https://dequeuniversity.com/rules/axe/4.4/accesskeys)."
"accessibility","aria-allowed-attr","1","","Each ARIA `role` supports a specific subset of `aria-*` attributes. Mismatching these invalidates the `aria-*` attributes. [Learn how to match ARIA attributes to their roles](https://dequeuniversity.com/rules/axe/4.4/aria-allowed-attr)."
"accessibility","aria-command-name","null","","When an element doesn't have an accessible name, screen readers announce it with a generic name, making it unusable for users who rely on screen readers. [Learn how to make command elements more accessible](https://dequeuniversity.com/rules/axe/4.4/aria-command-name)."
"accessibility","aria-hidden-body","1","","Assistive technologies, like screen readers, work inconsistently when `aria-hidden=""true""` is set on the document `<body>`. [Learn how `aria-hidden` affects the document body](https://dequeuniversity.com/rules/axe/4.4/aria-hidden-body)."
"accessibility","aria-hidden-focus","null","","Focusable descendents within an `[aria-hidden=""true""]` element prevent those interactive elements from being available to users of assistive technologies like screen readers. [Learn how `aria-hidden` affects focusable elements](https://dequeuniversity.com/rules/axe/4.4/aria-hidden-focus)."
"accessibility","aria-input-field-name","null","","When an input field doesn't have an accessible name, screen readers announce it with a generic name, making it unusable for users who rely on screen readers. [Learn more about input field labels](https://dequeuniversity.com/rules/axe/4.4/aria-input-field-name)."
"accessibility","aria-meter-name","null","","When an element doesn't have an accessible name, screen readers announce it with a generic name, making it unusable for users who rely on screen readers. [Learn how to name `meter` elements](https://dequeuniversity.com/rules/axe/4.4/aria-meter-name)."
"accessibility","aria-progressbar-name","null","","When a `progressbar` element doesn't have an accessible name, screen readers announce it with a generic name, making it unusable for users who rely on screen readers. [Learn how to label `progressbar` elements](https://dequeuniversity.com/rules/axe/4.4/aria-progressbar-name)."
"accessibility","aria-required-attr","1","","Some ARIA roles have required attributes that describe the state of the element to screen readers. [Learn more about roles and required attributes](https://dequeuniversity.com/rules/axe/4.4/aria-required-attr)."
"accessibility","aria-required-children","null","","Some ARIA parent roles must contain specific child roles to perform their intended accessibility functions. [Learn more about roles and required children elements](https://dequeuniversity.com/rules/axe/4.4/aria-required-children)."
"accessibility","aria-required-parent","null","","Some ARIA child roles must be contained by specific parent roles to properly perform their intended accessibility functions. [Learn more about ARIA roles and required parent element](https://dequeuniversity.com/rules/axe/4.4/aria-required-parent)."
"accessibility","aria-roles","1","","ARIA roles must have valid values in order to perform their intended accessibility functions. [Learn more about valid ARIA roles](https://dequeuniversity.com/rules/axe/4.4/aria-roles)."
"accessibility","aria-toggle-field-name","null","","When a toggle field doesn't have an accessible name, screen readers announce it with a generic name, making it unusable for users who rely on screen readers. [Learn more about toggle fields](https://dequeuniversity.com/rules/axe/4.4/aria-toggle-field-name)."
"accessibility","aria-tooltip-name","null","","When an element doesn't have an accessible name, screen readers announce it with a generic name, making it unusable for users who rely on screen readers. [Learn how to name `tooltip` elements](https://dequeuniversity.com/rules/axe/4.4/aria-tooltip-name)."
"accessibility","aria-treeitem-name","null","","When a `treeitem` element doesn't have an accessible name, screen readers announce it with a generic name, making it unusable for users who rely on screen readers. [Learn more about labeling `treeitem` elements](https://dequeuniversity.com/rules/axe/4.4/aria-treeitem-name)."
"accessibility","aria-valid-attr-value","1","","Assistive technologies, like screen readers, can't interpret ARIA attributes with invalid values. [Learn more about valid values for ARIA attributes](https://dequeuniversity.com/rules/axe/4.4/aria-valid-attr-value)."
"accessibility","aria-valid-attr","1","","Assistive technologies, like screen readers, can't interpret ARIA attributes with invalid names. [Learn more about valid ARIA attributes](https://dequeuniversity.com/rules/axe/4.4/aria-valid-attr)."
"accessibility","button-name","1","","When a button doesn't have an accessible name, screen readers announce it as ""button"", making it unusable for users who rely on screen readers. [Learn how to make buttons more accessible](https://dequeuniversity.com/rules/axe/4.4/button-name)."
"accessibility","bypass","1","","Adding ways to bypass repetitive content lets keyboard users navigate the page more efficiently. [Learn more about bypass blocks](https://dequeuniversity.com/rules/axe/4.4/bypass)."
"accessibility","color-contrast","1","","Low-contrast text is difficult or impossible for many users to read. [Learn how to provide sufficient color contrast](https://dequeuniversity.com/rules/axe/4.4/color-contrast)."
"accessibility","definition-list","null","","When definition lists are not properly marked up, screen readers may produce confusing or inaccurate output. [Learn how to structure definition lists correctly](https://dequeuniversity.com/rules/axe/4.4/definition-list)."
"accessibility","dlitem","null","","Definition list items (`<dt>` and `<dd>`) must be wrapped in a parent `<dl>` element to ensure that screen readers can properly announce them. [Learn how to structure definition lists correctly](https://dequeuniversity.com/rules/axe/4.4/dlitem)."
"accessibility","document-title","1","","The title gives screen reader users an overview of the page, and search engine users rely on it heavily to determine if a page is relevant to their search. [Learn more about document titles](https://dequeuniversity.com/rules/axe/4.4/document-title)."
"accessibility","duplicate-id-active","null","","All focusable elements must have a unique `id` to ensure that they're visible to assistive technologies. [Learn how to fix duplicate `id`s](https://dequeuniversity.com/rules/axe/4.4/duplicate-id-active)."
"accessibility","duplicate-id-aria","1","","The value of an ARIA ID must be unique to prevent other instances from being overlooked by assistive technologies. [Learn how to fix duplicate ARIA IDs](https://dequeuniversity.com/rules/axe/4.4/duplicate-id-aria)."
"accessibility","form-field-multiple-labels","null","","Form fields with multiple labels can be confusingly announced by assistive technologies like screen readers which use either the first, the last, or all of the labels. [Learn how to use form labels](https://dequeuniversity.com/rules/axe/4.4/form-field-multiple-labels)."
"accessibility","frame-title","null","","Screen reader users rely on frame titles to describe the contents of frames. [Learn more about frame titles](https://dequeuniversity.com/rules/axe/4.4/frame-title)."
"accessibility","heading-order","1","","Properly ordered headings that do not skip levels convey the semantic structure of the page, making it easier to navigate and understand when using assistive technologies. [Learn more about heading order](https://dequeuniversity.com/rules/axe/4.4/heading-order)."
"accessibility","html-has-lang","0","","If a page doesn't specify a `lang` attribute, a screen reader assumes that the page is in the default language that the user chose when setting up the screen reader. If the page isn't actually in the default language, then the screen reader might not announce the page's text correctly. [Learn more about the `lang` attribute](https://dequeuniversity.com/rules/axe/4.4/html-has-lang)."
"accessibility","html-lang-valid","null","","Specifying a valid [BCP 47 language](https://www.w3.org/International/questions/qa-choosing-language-tags#question) helps screen readers announce text properly. [Learn how to use the `lang` attribute](https://dequeuniversity.com/rules/axe/4.4/html-lang-valid)."
"accessibility","image-alt","0","","Informative elements should aim for short, descriptive alternate text. Decorative elements can be ignored with an empty alt attribute. [Learn more about the `alt` attribute](https://dequeuniversity.com/rules/axe/4.4/image-alt)."
"accessibility","input-image-alt","null","","When an image is being used as an `<input>` button, providing alternative text can help screen reader users understand the purpose of the button. [Learn about input image alt text](https://dequeuniversity.com/rules/axe/4.4/input-image-alt)."
"accessibility","label","0","","Labels ensure that form controls are announced properly by assistive technologies, like screen readers. [Learn more about form element labels](https://dequeuniversity.com/rules/axe/4.4/label)."
"accessibility","link-name","0","","Link text (and alternate text for images, when used as links) that is discernible, unique, and focusable improves the navigation experience for screen reader users. [Learn how to make links accessible](https://dequeuniversity.com/rules/axe/4.4/link-name)."
"accessibility","list","null","","Screen readers have a specific way of announcing lists. Ensuring proper list structure aids screen reader output. [Learn more about proper list structure](https://dequeuniversity.com/rules/axe/4.4/list)."
"accessibility","listitem","null","","Screen readers require list items (`<li>`) to be contained within a parent `<ul>`, `<ol>` or `<menu>` to be announced properly. [Learn more about proper list structure](https://dequeuniversity.com/rules/axe/4.4/listitem)."
"accessibility","meta-refresh","null","","Users do not expect a page to refresh automatically, and doing so will move focus back to the top of the page. This may create a frustrating or confusing experience. [Learn more about the refresh meta tag](https://dequeuniversity.com/rules/axe/4.4/meta-refresh)."
"accessibility","meta-viewport","1","","Disabling zooming is problematic for users with low vision who rely on screen magnification to properly see the contents of a web page. [Learn more about the viewport meta tag](https://dequeuniversity.com/rules/axe/4.4/meta-viewport)."
"accessibility","object-alt","0","","Screen readers cannot translate non-text content. Adding alternate text to `<object>` elements helps screen readers convey meaning to users. [Learn more about alt text for `object` elements](https://dequeuniversity.com/rules/axe/4.4/object-alt)."
"accessibility","tabindex","null","","A value greater than 0 implies an explicit navigation ordering. Although technically valid, this often creates frustrating experiences for users who rely on assistive technologies. [Learn more about the `tabindex` attribute](https://dequeuniversity.com/rules/axe/4.4/tabindex)."
